{
    "$schema": "http://json-schema.org/draft-07/schema#",
    "$id": "SampleComplex.table.json",
    "title": "SampleComplex",
    
    "type": "array",
    "items": {
        "description": "복합 샘플 테이블 항목",
        "type": "object",
        "properties": {
            "id": { "description": "ID", "type": "string" },
            "name": { "description": "스테이지명", "type": "string" },
            "openTimes": {
                "description": "개방 시간",
                "type": "array",
                "items": { "$ref": "Struct.schema.json#/definitions/ContentsOpenTime" }
            },
            "rewards": {
                "description": "보상 아이템 목록",
                "type": "array",
                "items": {
                    "type": "object",
                    "properties": {
                        "itemId": { "description": "아이템 ID", "type": "integer" },
                        "count": { "description": "아이템 수량", "type": "integer" },
                        "condition": {
                            "description": "보상 획득 조건",
                            "type": "object",
                            "properties": {
                                "firstClear": { "description": "최초 클리어", "type": "boolean" },
                                "timeLimit": { "description": "클리어 시간 제한. 단위: 초", "type": "integer" }
                            }
                        },
                        "messages": {
                            "description": "보상 획득 시 메시지 목록",
                            "type": "array",
                            "items": {
                                "description": "보상 획득 시 메시지",
                                "type": "object",
                                "properties": {
                                    "text": { "description": "메시지", "type": "string" },
                                    "delay": { "description": "메시지 등장 딜레이. 단위: 초", "type": "number" }
                                }
                            }
                        }
                    }
                }
            },
            "exp": {
                "type": "object",
                "properties": {
                    "accountExp": { "description": "계정 경험치", "type": "integer" },
                    "characterExp": { "description": "캐릭터 경험치", "type": "integer" }
                }
            }
        },
        "required": [ "id" ]
    }
}